{
 "hypothesis_id": "hyp_01c4d9e2f7a1",
 "run_id": "adr_3322182605da76d37631b9dc0e0e7cbf",
 "parent_hypothesis_ids": [],
 "revision": 2,
 "statement": "Amateur athletes doing home cold-water immersion cannot hold target temperature without a chiller and improvise insulation and ice routines.",
 "mechanism": "passive heat gain in an uninsulated tub outpaces ice addition in warm months",
 "population": "amateur athletes practising post-training cold immersion at home",
 "activity": "cold-water immersion at home",
 "task": "keep water at target temperature for the session",
 "context": "outdoor or garage tub, summer, no powered chiller",
 "suspected_friction": "temperature control",
 "status": "strengthened",
 "knowledge_support": [
  {
   "chunk_id": "chunk_7f3a",
   "document_id": "doc_554b59",
   "graph_fact_id": null,
   "retrieval_trace_id": "qr_4d0e",
   "evidence_role": "mechanism"
  },
  {
   "chunk_id": null,
   "document_id": null,
   "graph_fact_id": "fact_19c2",
   "retrieval_trace_id": null,
   "evidence_role": "friction"
  }
 ],
 "trail_priors": [
  {
   "registry_snapshot_id": "trs_20260913_7c1e",
   "registry_record_id": "fr-thermal_moisture",
   "prior_role": "friction_primitive"
  }
 ],
 "field_evidence_ids": [
  "fev_9a1b2c3d4e5f",
  "fev_9a1b2c3d4e60"
 ],
 "assumptions": [
  "most practitioners lack a powered chiller"
 ],
 "contradictions": [
  {
   "statement": "one community reports plunging only in winter, when drift is not a problem",
   "evidence_ids": [
    "fev_9a1b2c3d4e61"
   ]
  }
 ],
 "falsifiers": [
  "temperature drift is not mentioned as recurring across three independent communities"
 ],
 "knowledge_gaps": [
  {
   "gap_id": "gap_3",
   "question": "how large is the population plunging in warm months",
   "evidence_role": "demand",
   "status": "open"
  }
 ],
 "created_at": "2026-09-13T19:58:00Z",
 "updated_at": "2026-09-13T20:40:12Z"
}
